{
  "$schema": "https://json-schema.org/draft/2020-12/schema",
  "title": "Unused controller reset archive v1",
  "type": "object",
  "additionalProperties": false,
  "required": [
    "schema_version",
    "record_type",
    "request_id",
    "state_root",
    "config_root",
    "files",
    "objects",
    "complete"
  ],
  "properties": {
    "schema_version": {
      "type": "integer",
      "const": 1
    },
    "record_type": {
      "const": "unused-controller-reset"
    },
    "request_id": {
      "type": "string",
      "pattern": "^[A-Za-z0-9][A-Za-z0-9_.-]{0,127}$"
    },
    "state_root": {
      "type": "string",
      "pattern": "^/.+"
    },
    "config_root": {
      "type": "string",
      "pattern": "^/.+"
    },
    "files": {
      "type": "object",
      "additionalProperties": false,
      "required": [
        "state/controller.sqlite",
        "state/controller.sqlite-wal",
        "state/controller.sqlite-shm",
        "state/controller.sqlite-journal",
        "state/settings.json",
        "state/private/controller-service.json",
        "config/setup-progress.json",
        "config/setup-service.json"
      ],
      "properties": {
        "state/controller.sqlite": {
          "anyOf": [
            {
              "type": "null"
            },
            {
              "$ref": "#/$defs/source"
            }
          ]
        },
        "state/controller.sqlite-wal": {
          "anyOf": [
            {
              "type": "null"
            },
            {
              "$ref": "#/$defs/source"
            }
          ]
        },
        "state/controller.sqlite-shm": {
          "anyOf": [
            {
              "type": "null"
            },
            {
              "$ref": "#/$defs/source"
            }
          ]
        },
        "state/controller.sqlite-journal": {
          "anyOf": [
            {
              "type": "null"
            },
            {
              "$ref": "#/$defs/source"
            }
          ]
        },
        "state/settings.json": {
          "anyOf": [
            {
              "type": "null"
            },
            {
              "$ref": "#/$defs/source"
            }
          ]
        },
        "state/private/controller-service.json": {
          "anyOf": [
            {
              "type": "null"
            },
            {
              "$ref": "#/$defs/source"
            }
          ]
        },
        "config/setup-progress.json": {
          "anyOf": [
            {
              "type": "null"
            },
            {
              "$ref": "#/$defs/source"
            }
          ]
        },
        "config/setup-service.json": {
          "anyOf": [
            {
              "type": "null"
            },
            {
              "$ref": "#/$defs/source"
            }
          ]
        }
      }
    },
    "objects": {
      "type": "array",
      "maxItems": 10000,
      "uniqueItems": true,
      "items": {
        "type": "string",
        "pattern": "^[0-9a-f]{64}$"
      }
    },
    "complete": {
      "type": "boolean"
    }
  },
  "$defs": {
    "source": {
      "type": "object",
      "additionalProperties": false,
      "required": [
        "identity",
        "sha256",
        "size"
      ],
      "properties": {
        "identity": {
          "type": "array",
          "minItems": 5,
          "maxItems": 5,
          "items": {
            "type": "integer",
            "minimum": 0
          }
        },
        "sha256": {
          "type": "string",
          "pattern": "^[0-9a-f]{64}$"
        },
        "size": {
          "type": "integer",
          "minimum": 0,
          "maximum": 134217728
        }
      }
    }
  }
}
